{
  "type": "FeatureCollection",
  "timeStamp": "2024-02-24T12:00:00Z",
  "numberMatched": 1,
  "numberReturned": 1,
  "features": [
    {
      "type": "Feature",
      "id": "building_001",
      "geometry": {
        "type": "Point",
        "coordinates": [5.0, 52.0]
      },
      "properties": {
        "start_time": "2018-01-01T00:00:00Z",
        "end_time": "2018-12-31T23:00:00Z",
        "resolution": 60,
        "resolution_unit": "minutes",
        "buem": {
          "building_attributes": {
            "A_ref": 100.0,
            "h_room": 2.5,
            "components": {
              "Walls": {
                "U": 1.6,
                "b_transmission": 1.0,
                "elements": [
                  {
                    "id": "Wall_North",
                    "area": 30.0,
                    "azimuth": 0.0,
                    "tilt": 90.0
                  },
                  {
                    "id": "Wall_East",
                    "area": 25.0,
                    "azimuth": 90.0,
                    "tilt": 90.0,
                    "U": 1.4
                  },
                  {
                    "id": "Wall_South",
                    "area": 30.0,
                    "azimuth": 180.0,
                    "tilt": 90.0
                  },
                  {
                    "id": "Wall_West",
                    "area": 25.0,
                    "azimuth": 270.0,
                    "tilt": 90.0
                  }
                ]
              },
              "Roof": {
                "U": 1.2,
                "elements": [
                  {
                    "id": "Roof_Main",
                    "area": 100.0,
                    "azimuth": 180.0,
                    "tilt": 30.0
                  }
                ]
              },
              "Floor": {
                "U": 1.5,
                "elements": [
                  {
                    "id": "Floor_Ground",
                    "area": 100.0,
                    "azimuth": 0.0,
                    "tilt": 0.0
                  }
                ]
              },
              "Windows": {
                "U": 2.8,
                "g_gl": 0.6,
                "elements": [
                  {
                    "id": "Window_North",
                    "area": 6.0,
                    "azimuth": 0.0,
                    "tilt": 90.0,
                    "surface": "Wall_North"
                  },
                  {
                    "id": "Window_South",
                    "area": 8.0,
                    "azimuth": 180.0,
                    "tilt": 90.0,
                    "surface": "Wall_South"
                  },
                  {
                    "id": "Window_East",
                    "area": 4.0,
                    "azimuth": 90.0,
                    "tilt": 90.0,
                    "surface": "Wall_East",
                    "U": 2.5
                  }
                ]
              },
              "Doors": {
                "U": 3.0,
                "elements": [
                  {
                    "id": "Door_Main",
                    "area": 2.0,
                    "azimuth": 0.0,
                    "tilt": 90.0,
                    "surface": "Wall_North"
                  }
                ]
              },
              "Ventilation": {
                "elements": [
                  {
                    "id": "Vent_Natural",
                    "air_changes": 0.5
                  }
                ]
              }
            }
          },
          "use_milp": false
        }
      }
    }
  ]
}
